{"$id":"https://pleiades.local/schemas/modos-epistemic-ledger-v1.json","$schema":"https://json-schema.org/draft/2020-12/schema","title":"MODOS Epistemic Ledger","type":"object","additionalProperties":false,"required":["apiVersion","kind","metadata","spec"],"properties":{"apiVersion":{"const":"modos.pleiades/v1alpha1"},"kind":{"const":"EpistemicLedger"},"metadata":{"type":"object","additionalProperties":false,"required":["name","mindId","generatedAt","steward"],"properties":{"name":{"type":"string","pattern":"^[a-z0-9][a-z0-9._-]*$"},"mindId":{"type":"string","pattern":"^[a-z0-9][a-z0-9._-]*$"},"generatedAt":{"type":"string","format":"date-time"},"steward":{"type":"string","minLength":1},"notes":{"type":"string"}}},"spec":{"type":"object","additionalProperties":false,"required":["evidence","claims","arguments","decisions"],"properties":{"evidence":{"type":"array","items":{"type":"object","additionalProperties":false,"required":["id","kind","source","sourceGroup","summary","reliability"],"properties":{"id":{"type":"string","pattern":"^[a-z0-9][a-z0-9._-]*$"},"kind":{"enum":["observation","measurement","document","test","testimony","simulation","inference","counterexample","steward-judgment"]},"source":{"type":"string","minLength":1},"sourceGroup":{"type":"string","minLength":1},"summary":{"type":"string","minLength":1},"reliability":{"type":"number","minimum":0,"maximum":1},"digest":{"type":"string","pattern":"^sha256:[0-9a-f]{64}$"},"observedAt":{"type":"string","format":"date-time"},"generatedBy":{"type":"string"},"derivedFrom":{"type":"array","items":{"type":"string"},"uniqueItems":true}}}},"claims":{"type":"array","minItems":1,"items":{"type":"object","additionalProperties":false,"required":["id","proposition","scope","levelOfAnalysis","assertionMode","status","confidence","sourceAgent","categorySensitive","evidenceRefs","dependsOn","preservesDistinctions","alternatives","defeaters","revision"],"properties":{"id":{"type":"string","pattern":"^[a-z0-9][a-z0-9._-]*$"},"proposition":{"type":"string","minLength":1},"scope":{"type":"string","minLength":1},"levelOfAnalysis":{"enum":["linguistic","behavioral","clinical","individual","institutional","systemic","epistemic","causal","normative"]},"assertionMode":{"enum":["descriptive","diagnostic","causal","predictive","normative","analogical","operational"]},"status":{"enum":["hypothesis","provisional","accepted","canonical","disputed","rejected","superseded","suspended"]},"confidence":{"type":"number","minimum":0,"maximum":1},"sourceAgent":{"type":"string","minLength":1},"categorySensitive":{"type":"boolean"},"evidenceRefs":{"type":"array","items":{"type":"string"},"uniqueItems":true},"dependsOn":{"type":"array","items":{"type":"string"},"uniqueItems":true},"preservesDistinctions":{"type":"array","items":{"type":"string"},"uniqueItems":true},"potentialCollapses":{"type":"array","items":{"type":"object","additionalProperties":false,"required":["distinctionId","risk","mitigation"],"properties":{"distinctionId":{"type":"string"},"risk":{"type":"string","minLength":1},"mitigation":{"type":"string","minLength":1}}}},"alternatives":{"type":"array","items":{"type":"object","additionalProperties":false,"required":["proposition","status","confidence","sourceAgent"],"properties":{"proposition":{"type":"string","minLength":1},"status":{"enum":["active","weakened","rejected","unresolved"]},"confidence":{"type":"number","minimum":0,"maximum":1},"sourceAgent":{"type":"string","minLength":1}}}},"defeaters":{"type":"array","items":{"type":"object","additionalProperties":false,"required":["condition","effect"],"properties":{"condition":{"type":"string","minLength":1},"effect":{"enum":["lower-confidence","suspend","reject","reopen-debate","require-steward-review"]}}}},"revision":{"type":"object","additionalProperties":false,"required":["revision","supersedes","reason"],"properties":{"revision":{"type":"integer","minimum":1},"supersedes":{"type":"array","items":{"type":"string"},"uniqueItems":true},"reason":{"type":"string"}}},"reviewAfter":{"type":"string","format":"date-time"},"notes":{"type":"string"}}}},"arguments":{"type":"array","items":{"type":"object","additionalProperties":false,"required":["id","claimId","stance","agentId","confidence","grounds","attacks","status"],"properties":{"id":{"type":"string","pattern":"^[a-z0-9][a-z0-9._-]*$"},"claimId":{"type":"string"},"stance":{"enum":["support","attack","qualify"]},"agentId":{"type":"string","minLength":1},"confidence":{"type":"number","minimum":0,"maximum":1},"grounds":{"type":"array","items":{"type":"string"},"uniqueItems":true},"attacks":{"type":"array","items":{"type":"string"},"uniqueItems":true},"status":{"enum":["active","withdrawn","defeated"]},"rationale":{"type":"string"}}}},"decisions":{"type":"array","items":{"type":"object","additionalProperties":false,"required":["id","claimId","status","selectedArguments","dissentingArguments","decidedBy","decidedAt","rationale"],"properties":{"id":{"type":"string","pattern":"^[a-z0-9][a-z0-9._-]*$"},"claimId":{"type":"string"},"status":{"enum":["accept","reject","suspend","keep-disputed"]},"selectedArguments":{"type":"array","items":{"type":"string"},"uniqueItems":true},"dissentingArguments":{"type":"array","items":{"type":"string"},"uniqueItems":true},"decidedBy":{"type":"string","minLength":1},"decidedAt":{"type":"string","format":"date-time"},"rationale":{"type":"string","minLength":1},"reviewAfter":{"type":"string","format":"date-time"}}}}}}}}
