{"apiVersion":"modos.pleiades/v1alpha1","kind":"EpistemicLedger","metadata":{"name":"ontological-self-criticism-example","mindId":"pleiades","generatedAt":"2026-07-21T00:00:00Z","steward":"Pleiades ecology","notes":"Reference fixture demonstrating provenance, distinction preservation, attack graphs, revision hooks, and retained dissent."},"spec":{"evidence":[{"id":"ev-conversation-analysis","kind":"observation","source":"pleiades:conversation/2026-07/missing-distinction","sourceGroup":"steward-observation","summary":"Repeated examples showed that deliberate action was being forced into either conspiracy or accident, and descriptive language into either diagnosis or invalidity.","reliability":0.85,"observedAt":"2026-07-21T00:00:00Z","generatedBy":"steward-and-assistant"},{"id":"ev-dung-argumentation","kind":"document","source":"doi:10.1016/0004-3702(94)00041-X","sourceGroup":"formal-argumentation","summary":"Abstract argumentation represents attacks among arguments and evaluates acceptability without requiring premature deletion of conflict.","reliability":0.95,"observedAt":"2026-07-21T00:00:00Z","generatedBy":"research-ingest"},{"id":"ev-prov-o","kind":"document","source":"w3c:prov-o","sourceGroup":"standards","summary":"PROV-O supplies interoperable concepts for entities, activities, agents, derivation, attribution, and generation.","reliability":0.98,"observedAt":"2026-07-21T00:00:00Z","generatedBy":"research-ingest"},{"id":"ev-multiagent-diversity","kind":"document","source":"arxiv:2601.19921","sourceGroup":"multiagent-research","summary":"Debate quality depends on diverse initial viewpoints and explicit calibrated confidence rather than homogeneous repetition alone.","reliability":0.75,"observedAt":"2026-07-21T00:00:00Z","generatedBy":"research-ingest"}],"claims":[{"id":"claim-deliberate-not-conspiratorial","proposition":"Deliberate institutional action does not entail secret centralized coordination.","scope":"institutional causal analysis","levelOfAnalysis":"institutional","assertionMode":"causal","status":"accepted","confidence":0.91,"sourceAgent":"atlas-research-organ","categorySensitive":true,"evidenceRefs":["ev-conversation-analysis","ev-dung-argumentation"],"dependsOn":[],"preservesDistinctions":["deliberate-vs-conspiratorial","emergence-vs-accident"],"potentialCollapses":[{"distinctionId":"deliberate-vs-conspiratorial","risk":"Intentional local decisions may be rejected unless evidence also proves a hidden central plan.","mitigation":"Track intent evidence and coordination evidence as separate fields and permit distributed institutional intention."},{"distinctionId":"emergence-vs-accident","risk":"An emergent system result may be mislabeled accidental despite deliberate component actions.","mitigation":"Represent intention at component and aggregate levels independently."}],"alternatives":[{"proposition":"Only centrally coordinated outcomes should be described as deliberate at the institutional level.","status":"rejected","confidence":0.18,"sourceAgent":"categorical-skeptic"},{"proposition":"The outcome may be emergent while participating institutions still act deliberately.","status":"active","confidence":0.88,"sourceAgent":"systems-organ"}],"defeaters":[{"condition":"Evidence shows the attributed institution had neither awareness nor control over the relevant local action.","effect":"lower-confidence"},{"condition":"The claim is used to imply coordination beyond the available evidence.","effect":"reopen-debate"}],"revision":{"revision":1,"supersedes":[],"reason":"Initial promoted formulation."},"reviewAfter":"2027-01-21T00:00:00Z"},{"id":"claim-ontology-must-audit-itself","proposition":"A mature ontology ecology should detect when its own categories erase causally important middle spaces.","scope":"Pleiades ontology governance","levelOfAnalysis":"epistemic","assertionMode":"normative","status":"provisional","confidence":0.79,"sourceAgent":"ontology-critic","categorySensitive":true,"evidenceRefs":["ev-conversation-analysis","ev-prov-o","ev-multiagent-diversity"],"dependsOn":["claim-deliberate-not-conspiratorial"],"preservesDistinctions":["consensus-vs-evidence","description-vs-diagnosis","confusion-vs-deception"],"potentialCollapses":[{"distinctionId":"consensus-vs-evidence","risk":"Repeated agreement among correlated agents may be mistaken for independent support.","mitigation":"Track source groups, first-pass independence, confidence, and dissent."}],"alternatives":[{"proposition":"Ontology stability is more important than retaining unresolved distinctions.","status":"unresolved","confidence":0.36,"sourceAgent":"stability-organ"}],"defeaters":[{"condition":"Self-revision repeatedly damages compatibility without measurable explanatory gain.","effect":"require-steward-review"}],"revision":{"revision":1,"supersedes":[],"reason":"Initial research hypothesis."}}],"arguments":[{"id":"arg-local-intent","claimId":"claim-deliberate-not-conspiratorial","stance":"support","agentId":"institutional-analysis-organ","confidence":0.91,"grounds":["ev-conversation-analysis"],"attacks":["arg-centralization-objection"],"status":"active","rationale":"Intent can be demonstrated at the local institutional decision level without evidence of secret coordination."},{"id":"arg-centralization-objection","claimId":"claim-deliberate-not-conspiratorial","stance":"attack","agentId":"categorical-skeptic","confidence":0.42,"grounds":[],"attacks":["arg-local-intent"],"status":"active","rationale":"Institution-level intent may be rhetorically overextended when decision authority is diffuse."},{"id":"arg-scope-qualification","claimId":"claim-deliberate-not-conspiratorial","stance":"qualify","agentId":"causal-scope-organ","confidence":0.83,"grounds":["ev-dung-argumentation"],"attacks":[],"status":"active","rationale":"The claim is safe only when intent and coordination are recorded as distinct predicates."},{"id":"arg-self-audit-support","claimId":"claim-ontology-must-audit-itself","stance":"support","agentId":"ontology-critic","confidence":0.79,"grounds":["ev-prov-o","ev-multiagent-diversity"],"attacks":[],"status":"active","rationale":"Provenance, source diversity, and explicit counterpositions make ontology revision auditable rather than arbitrary."}],"decisions":[{"id":"decision-deliberate-not-conspiratorial","claimId":"claim-deliberate-not-conspiratorial","status":"accept","selectedArguments":["arg-local-intent","arg-scope-qualification"],"dissentingArguments":["arg-centralization-objection"],"decidedBy":"forge-steward-gate","decidedAt":"2026-07-21T00:00:00Z","rationale":"Promote the distinction while retaining the objection as a live warning against over-attribution.","reviewAfter":"2027-01-21T00:00:00Z"}]}}
